{"SchemaVersion":"amd-graphics-public-run-summary/1.0","ToolkitVersion":"1.0.0","GeneratedAtUtc":"2026-08-12T17:54:04.5112371Z","OverallStatus":"Pass","ExitCode":0,"SelectedStages":["Test","ProductDiscover","ProductMetadata","Select","Acquire","Extract","Inspect","Build"],"ScriptSha256":"7a604cbe33ab1f04c9ecfd28ac96f08e38254f26e7eb77fa19158239e7098cd8","ProductSelection":{"SelectionTrackCount":38,"TrackGenerationSelectionCount":95,"ArtifactSelectionCount":95,"UniqueSelectedArtifactCount":23,"EstimatedDownloadBytes":20981376616,"TrackEvidenceConflictCount":3},"PublishedDataset":{"ArtifactCount":23,"DriverCount":482},"BuildIntegrity":{"Status":"Pass","CumulativeArtifactCount":23,"CumulativeDriverCount":482,"ServerRowCount":1928},"Privacy":{"Classification":"PublicRepositoryArtifact","ContainsHostEnvironment":false,"ContainsAbsoluteLocalPaths":false,"DebugEvidenceLocation":"private/evidence (not published)"}}
